{
  "contract_id": "skill-opt.token-efficiency",
  "contract_version": 1,
  "consumer": "skill-booster",
  "operation": "optimize-existing",
  "mode": "apply",
  "target_skill": "./target-skill",
  "mutation_authorized": true,
  "staged_candidate": "./working-copy/candidate",
  "format_context": null,
  "tokenization": {
    "primary_method": "estimator-v1",
    "scope": "instructions"
  }
}
